Participant,Script,Trial,condition,Both,Letters,Locations,Start Time,Transcript,index.speech,End Time,Time,Seconds,Disfluencies,wordcount,Gesture,Total Iconic,Total Point,Total Beat,Comment,Include
3,2,9,NG,3,4,5,8:50,uhm there  was a triangle with its points at the bottom and then below it theres uhm a square the triangle has three points and the square has four points and the square is larger then the triangle ,n,9:10,0:20,20,2,40,,,,,,y
3,2,12,NG,0,1,2,13:28,uhm there are two diamond shapes there is one that is skinnier that is in the right corner then there is a fatter one that is in the left corner and the fatter one is lower to the gronud then the skinny one,n,13:52,0:24,24,1,43,,,,,,y
3,2,17,NG,0,0,4,19:44,uhm theres a square and theres theres a square an equilateral square uhm that has four points then theres a triangle uhm a skinny triangle inside it with three points and I think it has one point in the center in the center of the triangle ,n,20:10,0:26,26,5,47,,,,,,y
3,2,21,NG,0,3,3,24:03:00,uhm I think it was like there was a triangle and there also was a rhombus so there would have been four and three points so I was kind of distracted ,n,24:25:00,0:22,22,1,32,,,,,,y
3,2,23,NG,0,1,1,25:59:00,uhm theres a triagnle and below it theres uhm a trapezoid that’s upside down so there are three and four dots ,n,26:14:00,0:15,15,2,22,,,,,,y
4,3,1,NG,2,5,2,0:09,there are two separate shapes one is an obtuse triangle that ones on the left with a dot on each corner then is just a four sided parallegram um and they are both taller then they are wider ,n,0:28,0:19,19,1,39,,,,,,y
4,3,3,NG,0,5,2,1:51,uhm so this one is a rectangle with a dot in each corner and a dot in the middle with a horizantal line below it with a dot at both sides of it ,n,2:05,0:14,14,1,34,,,,,,y
4,3,8,NG,0,3,2,5:46,alright so this one is two rhombuses uhm kind of on top of eahc other but kind of also on the side theres one in the top like more towords the top left top right and then its connected to the corner of one that’s more off to the bottom on the left and theres a dot at each corner,n,6:17,0:31,31,2,60,,,,,,y
4,3,10,NG,2,4,4,7:26,alright so this one is uhm there were 6 dots surrondning one dot in  the middle and the dot in the middle has a line cononceting it to each of the outside dots and the outside dots are not connceted ,n,7:39,0:13,13,1,42,,,,,,y
4,3,13,NG,2,5,2,9:19,alright so this one is a rectangle on top and there is a dot in each corner and then there is a triangle below it and the top corner of the triangle is in the middle or it starts in the middle of the base of the rectangle also with a dot in each corner ,n,9:43,0:24,24,1,56,,,,,,y
4,3,14,NG,2,4,3,10:01,so this one is a triangle standing on its point with a dot on each corner then on the two points that are diagnol like theyre not on top theyre coming up from the base of it like from the points base they have a dot in the center of the line and then there are two dots two on each side,n,10:23,0:22,22,1,62,,,,,,y
4,3,19,NG,0,0,1,14:12,this is two separate triangles one is obtuse and its towards the top closer to the top right of the page with a dot in each corner and then the other one is a rigt triangle uhm with its hypotenase pointing down and the-with a dot in each corner and theres a dot in on the left right most side,n,14:43,0:31,31,3,60,,,,,,y
4,3,24,NG,1,5,2,17:56,this is two rhombuses on top of each other and theyre conncted by a corner  which has a dot on it all the corners have dots on them and uhm uh and all the corners are rather theyre not on the base if they were to stand they would stand on the corner,n,18:22,0:26,26,2,54,,,,,,y
5,3,3,NG,4,5,4,0:42,there was a rectangle with a dot in the middle and then a little line on the bottom with dots on the ends,n,0:48,0:06,6,0,23,,,,,,y
5,3,8,NG,0,4,1,4:14,there were kindof like sideways facing diamonds for like the top right one had top right one the point was connected to the bottom left one there were two of them and one of them was connected together yea,n,4:35,0:21,21,1,39,,,,,,y
5,3,10,NG,3,4,5,5:46,there is there were three lines two made an x and one went down the middle there were points on each end connecting to where they intesect on the ends of it,n,6:01,0:15,15,1,32,,,,,,y
5,3,13,NG,3,4,4,7:30,there was a rectangle with all points on the side and then a triangle connected to the bottom line and then theres a dot in the middle of the bottom line connecting to the top of the triangle,n,7:40,0:10,10,0,38,,,,,,y
5,3,14,NG,2,5,3,8:08,there was a triangle and the point was facing downards on the  left and right sides of the one faced downwards then there was a dot in the middle and two dots on either side of it not connected to the triangle ,n,8:21,0:13,13,0,44,,,,,,y
5,3,19,NG,1,4,2,11:28,theres a triangle in the very bottom left corner that is facing towards the right corner on the side going down there was a dot in the middle and there was another triangle above it and the right had dots on each end,n,11:38,0:10,10,0,43,,,,,,y
5,3,24,NG,2,5,3,14:34,there were two diamonds but instead of facing upwards they were to the side horizantally and then there were points on each end and they were connected by a central point on the end. ,n,14:47,0:13,13,0,35,,,,,gestures with head,y
6,3,1,NG,0,1,1,0:00,and then theres another one that a pot a pair a quadratic uhm both on their sides and tilted ,n,0:11,0:11,11,4,20,,,,,he's cut off a bit in the beginning,y
6,3,3,NG,2,4,4,1:31,there was a square with dots in the middle and a line right below it with two dots connecting it,n,1:40,0:09,9,0,20,,,,,,y
6,3,8,NG,2,3,3,5:17,this one was a two per-quadatricals on the sides connecting to each in the on the end,n,5:30,0:13,13,2,17,,,,,,y
6,3,10,NG,3,5,4,6:35,this one was a hold on uhm were lines that were similar to one of a circle as well as a snowflake,n,6:52,0:17,17,1,22,,,,,,y
6,3,13,NG,1,2,2,9:07,this one was a rectangle on top of a triangle and the triangle connected to the rectangles bottom line,n,9:16,0:09,9,0,19,,,,,,y
6,3,14,NG,0,4,1,9:41,this one is a triangle with two dots on the congruent lines and then two dots that were symmetical of the bottom dot that were out that were kind of to the triangle,n,9:56,0:15,15,1,33,,,,,,y
6,3,19,NG,0,2,1,13:25,this was two triangles some were to each other and yet the bottom one had uh a mint plate on uhm on the right side ,n,13:36,0:11,11,3,26,,,,,,y
6,3,24,NG,3,5,4,17:35,this one was two like diamonds that were stretched out horizantally uhm on top of each other no not on top of each other one on top of the other ,n,17:51,0:16,16,2,31,,,,,,y
7,2,4,NG,1,2,3,1:39,so I have trapezoid with dots around it then a triangle uh a little to the right ,n,1:48,0:09,9,1,18,,,,,,y
7,2,5,NG,0,5,1,2:10,you have a triangle with four dots and then a tirangle with three dots so its right,n,2:18,0:08,8,0,17,,,,,,y
7,2,9,NG,0,1,3,4:32,so you have a triangle with three dots and thena  rectangle with four dots ,n,4:37,0:05,5,0,16,,,,,,y
7,2,12,NG,3,4,3,6:19,so you have a trapezoid uhm with four dots in it and a triangle with three ,n,6:26,0:07,7,1,17,,,,,,y
7,2,17,NG,1,3,2,8:53,so you have a rectangle with four dots and then in the middle upside down triangle with three dots ,n,9:00,0:07,7,0,20,,,,,,y
7,2,21,NG,0,4,1,10:55,so theres a triangle with three dots and a rhombus with four dots below it ,n,11:00,0:05,5,0,16,,,,,,y
7,2,23,NG,0,2,1,11:54,so theres an upside down triangle with three dots and then a trapezoid with four dots ,n,12:00,0:06,6,0,17,,,,,,y
8,1,2,NG,0,3,3,0:49,there was a hexagon with two dots on each like connecting each line and then a dot in the middle ,n,0:59,0:10,10,1,21,,,,,,y
8,1,6,NG,0,1,4,3:15,there was a triangle on the top with a dot in each corner and a dot in the middle on the bottom line and then another triangle at the bottom with dots in each corner ,n,3:28,0:13,13,0,36,,,,,,y
8,1,7,NG,0,1,2,3:48,there was a trapezoid with dots in each corner and then a dot in the middle on the bottom line and from that dot on the bottom line there was another line that had two other dots in it to where it was connected to the trapezoid,n,4:05,0:17,17,0,47,,,,,,y
8,1,11,NG,0,0,3,6:18,there was a diamond that had dots in each corner on top of the trapezoid that had dots in each corner ,n,6:27,0:09,9,0,22,,,,,,y
8,1,16,NG,1,4,2,8:52,theres two triangles lumped together at a dot in the middle then each triangle has dots at each corner ,n,9:02,0:10,10,0,20,,,,,,y
8,1,18,NG,0,0,2,9:48,there was a big rectangle with two dots on the top corners and two dots on the bottom corners and two dots in the middle of the left and right sides and the dot at the right side was connected to a triangle that ha dots at uh each of their three corners ,n,10:08,0:20,20,1,54,,,,,,y
8,1,20,NG,3,5,3,11:12,there were three triangles that each had uhm dots at each corner and then they met at one dot in the middle so there were two triangles at the left and right and then one triangle the uh ,n,11:31,0:19,19,1,39,,,,,,y
8,1,22,NG,0,2,1,12:15,there was a line at the top with dots at each corner and then two triangles at the bottom that each had dots at each corner uhm,n,12:26,0:11,11,1,27,,,,,,y
9,3,1,NG,2,5,2,0:08,okay so there's uhm a triangle uh there's a triangle on the left side uhm with a long side facing towards the left and then on the right side theres uh a diamond shape and theyre both in with uh dots on each side on all corners ,n,0:28,0:20,20,6,48,,,,,,y
9,3,3,NG,1,2,4,1:58,uhm I think that was a square with a dot in the center with dots on all sides and dots,n,2:12,0:14,14,1,20,,,,,,y
9,3,14,NG,0,2,2,10:03,so theres a triangle with the bottom pointing down and then level with that dot at the bottom has two other dots on both sides uh on each sideline I should say,n,10:18,0:15,15,1,32,,,,,,y
9,3,19,NG,0,2,2,13:25,okay uh on top there was a small triangle uh like acute triangle then on bottom left of that theres a right triangle with a 90 degree side facing uh kind of closest to the acute triangle,n,13:42,0:17,17,3,37,,,,,,y
9,3,24,NG,0,3,1,17:20,so theres two diamonds on top of or one is on top and one is on bottom and theyre connceted at a single dot theres four dots on each ,n,17:29,0:09,9,1,30,,,,,,y
10,2,4,NG,1,1,2,2:59,uhm I saw a uhm trapezoid kind of sideways and then uhm a triangle sideways next to it ,n,3:11,0:12,12,3,19,,,,,,y
10,2,5,NG,0,2,2,3:55,uhm I saw two triangles uhm both kind of sideways ,n,4:03,0:08,8,1,11,,,,,,y
10,2,9,NG,2,3,3,7:00,uhm I saw uh an upside down triangle and uhm a rectangle the triangle on top of the rectangle ,n,7:11,0:11,11,3,20,,,,,,y
10,2,12,NG,0,0,3,9:10,uhm I saw a triangle uhm twoards the bottom left and then a rhombus uh the upper right ,n,9:21,0:11,11,3,19,,,,,,y
10,2,15,NG,3,4,3,11:22,uhm I saw two trirangles overlapping each other onne being longer then the other one ,n,11:31,0:09,9,1,16,,,,,,y
10,2,17,NG,2,2,2,12:44,uhm I saw a rectangle and then a triangle inside of the rectangle ,n,12:50,0:06,6,1,14,,,,,,y
10,2,21,NG,0,4,2,15:18,uhm I saw uhm a rhombus kind of sideways and then a triangle on top uhm not connected ,n,15:29,0:11,11,3,19,,,,,,y
10,2,23,NG,1,2,4,16:28,uhm I saw an upside down uhm triangle and then an upside down trapezoid both not being connected ,n,16:37,0:09,9,2,19,,,,,,y
11,2,4,NG,3,3,4,1:47,Um it was what's it called I think a parallel not a parallelogram I can't even remember uh a vertical line with it's hard to do without my hands okay two lines coming off one going northeast and one going southeast and then those two points connecting each other for a line and then there's a triangle in the middle that I cannot remember what that shape's called okay,n,2:24,0:37,37,3,69,,,,,,y
11,2,5,NG,0,1,4,2:57,Um there was a right triangle with a dot in each corner and one on the um I'm forgetting all my geometry words the slanted leg of it and then there was an isosceles triangle with a point in all the corners ,n,3:17,0:20,20,2,43,,,,,,y
11,2,9,NG,5,5,5,6:38,I forgot about that I just stared at it and didn't process any of it okay um let's say there was a rectangle with dots on each corner and an upside down triangle on top with a dot in each corner I literally stared at the screen without processing any of it ,n,7:02,0:24,24,1,53,,,,,,y
11,2,12,NG,0,0,0,8:52,Um a parallelogram with a dot on each side and then to the bottom left of that there was a right triangle ,n,9:04,0:12,12,1,23,,,,,,y
11,2,15,NG,3,4,3,10:36,Um an upside down triangle that's kinda skinny with a dot on each side and in the middle of that triangle expanding out is an isosceles triangel with a dot on each side ,n,10:54,0:18,18,1,34,,,,,,y
11,2,17,NG,3,3,3,12:07,Um a rectangle with a dot on each side and then on the bottom leg of it there's an upside down triangle touching it with a dot on each point ,n,12:22,0:15,15,1,31,,,,,,y
11,2,21,NG,2,3,3,14:58,Um a triangle upside down at the top with a point at each corner and then to the bottom left of that there's a parallelogram with a dot on each corner,n,15:15,0:17,17,1,31,,,,,,y
11,2,23,NG,3,3,4,16:37,Um kind of a flatter triangle um upside down with a point on each side and I don't remember the shape underneath the shape but it was a shape ,n,16:54,0:17,17,2,30,,,,,,y
12,1,2,NG,0,1,0,0:55,Okay there's a um was there eight I think it was an octagon with um a dot in the middle and a dot at each corner ,n,1:10,0:15,15,2,27,,,,,,y
12,1,6,NG,0,0,0,3:14,There's two triangles um with a dot at each corner of the triangle on both triangles ,n,3:26,0:12,12,1,17,,,,,,y
12,1,7,NG,1,1,1,3:47,There's a I forget what it's called but I know what it is um and there's dot at each corner and then a line um with a dot at the end ,n,4:05,0:18,18,3,32,,,,,,y
12,1,11,NG,2,2,2,6:08,There's two dots on top um connected to two dots on below that are wider than the top dots and they're all connected by lines and there's a rectangle with dots on the bottom ,n,6:30,0:22,22,1,35,,,,,,y
12,1,16,NG,0,1,0,9:12,There's um two triangles with um dots on each corner that are connected at uh at um a tip with a dot and um two other dots on the side far lines from where they connect ,n,9:38,0:26,26,5,37,,,,,,y
12,1,18,NG,0,0,1,10:35,There's a triangle and there's a dot at each corner and um other stuff ,n,10:59,0:24,24,1,15,,,,,,y
12,1,20,NG,2,3,2,12:05,There's three triangles with dots at each corners um that are all touching one center dot ,n,12:15,0:10,10,1,17,,,,,,y
12,1,22,NG,0,0,0,13:21,There's a line at the top um with a dot at each end and two triangles below it um they're connected um at their bottom point and have a dot at each  corner ,n,13:38,0:17,17,3,35,,,,,,y
13,1,7,NG,0,4,0,4:12,So there was a line uh with with a dot at the end of it at the bottom of it connected to a trapezoid um with a dot in each corner and one in between ,n,4:28,0:16,16,3,36,,,,,,y
13,1,11,NG,0,0,3,6:39,Uh so there was another diamond um at the top with with a dot on each corner connected to a um a trapezoid with a dot on each corner ,n,6:50,0:11,11,4,30,,,,,,y
13,1,16,NG,0,1,0,9:43,Uh so there was a triangle tilted on its side um with a dot in each corner and a dot in between the longest line um and the same thing on the other side uh on its left ,n,10:03,0:20,20,4,39,,,,,,y
13,1,18,NG,1,3,2,10:58,Uh so there was a um uh a trapezoid with uh with a dot on each corner connected to a triangle with a dot on each corner um and a dot in between one of the lines ,n,11:17,0:19,19,6,38,,,,,,y
13,1,20,NG,4,5,4,12:25,Uh so there was a total of three triangles with one um with a dot on each corner and a dot in the middle connecting all three ,n,12:34,0:09,9,3,28,,,,,,y
14,2,4,NG,0,2,1,2:24,Alright there is uh a four sided object that has four dots at each corner one end is shorter than the other there two of them that consist of two parallel lines and two non parallel lines um and then something else on the right ,n,2:50,0:26,26,2,46,,,,,,y
14,2,5,NG,1,4,1,3:29,Alright there is one right triangle um consisting of three dots and the line going north to south is longer than the east west line then there's there another triangle that is not a right triangle again with the longest line going north to south,n,3:49,0:20,20,2,45,,,,,,y
14,2,9,NG,2,4,4,7:15,Alright there's a tri an upside triangle with a point attaching to a rectangular box underneath at each corner there's a dot ,n,7:28,0:13,13,1,23,,,,,,y
14,2,12,NG,0,5,2,9:44,Alright um the upper right corner there's a four sided something with dots at the corners bottom left there is a triangle um the hypotenuse of which is facing the four sided object,n,10:10,0:26,26,2,33,,,,,,y
14,2,15,NG,0,3,2,12:11,Alright there's a long skinny triangle with a point facing downwards and then on top of it sort of centered is a wide but short triangle ,n,12:29,0:18,18,0,27,,,,,,y
14,2,21,NG,1,5,3,16:40,Hmmm okay like a sideways diamond like thing on the bottom right oh a triangle on top with three dots ,n,16:54,0:14,14,0,21,,,,,,y
14,2,23,NG,0,0,1,17:57,There is a wide but short triangle of three dots and then below a long line on top a short lineon the bottom and like lines connecting those also made out of four dots ,n,18:22,0:25,25,0,35,,,,,,y
15,2,12,NG,3,4,4,8:08,Uh so to the right there's a parallelogram with um dots on each corner and then not connected to the left there's an obtuse triangle with dots on each corner ,n,8:23,0:15,15,2,31,,,,,,y
15,2,15,NG,3,3,4,10:14,Alright so there's two triangles uh there's a and they are overlapping yeah so the tall one has dots on each corner there's one that's like stretched and one that's compressed and so the stretched one there's dots on each corner and the um yeah the stretched one has dots on each corner and it also has a dot on halfway through the one of the line segments and it's also in the middle of the um the compressed triangle so yeah they're overlapping,n,10:55,0:41,41,4,84,,,,,,y
15,2,17,NG,1,2,3,11:56,Okay so there's a square with dots on each corner and then halfway through the bottom line segment there's a dot and then that's um there's a triangle inside of the square upside down triangle dots on each corner and um the dot that's on the square on the line segment of the square is one of hte vertices of the triangle,n,12:26,0:30,30,3,62,,,,,,y
15,2,21,NG,2,4,3,15:49,So there's a triangle on top dots on each corner um and then a parallelogram on the bottom with dots on each corner ,n,16:02,0:13,13,1,24,,,,,,y
15,2,23,NG,2,2,3,17:50,So the top the top figure is a triangle dots on each corner and the bottom one is a trapezoid dots on each corner with the line segment on the bottom being smaller and the one on the top being bigger ,n,18:06,0:16,16,1,42,,,,,,y
16,2,4,NG,3,3,3,2:36,So there was a shape with four sides but it was irregular and a triangle I think and it they had dots on all of the corners ,n,2:55,0:19,19,1,28,,,,,,y
16,2,5,NG,0,2,1,3:25,So there were two triangles one had they all had dots in the corners but one had a dot in the middle ,n,3:36,0:11,11,1,23,,,,,,y
16,2,9,NG,2,2,2,6:01,Um there was a triangle upside down and a rectangle beneath it and it had dots in the corners ,n,6:11,0:10,10,1,20,,,,,,y
16,2,12,NG,2,3,4,8:05,So there was a um diamond shape with dots in all the corners and a triangle beneath it with dots in the corners ,n,8:15,0:10,10,1,24,,,,,,y
16,2,15,NG,0,0,0,9:43,There were two triangles uh with dots in the corners and one was shorter and the other one was longer and there was a dot in the middle of the one of the lines of the longer I mean shorter triangle ,n,10:07,0:24,24,1,42,,,,,,y
16,2,17,NG,0,0,0,10:54,There was a square with dots in the corners and there was also a triangle inside the square with dots in all of its corners ,n,11:04,0:10,10,0,26,,,,,,y
16,2,21,NG,2,3,2,13:08,So there was a triangle with dots in the corners and then below that was a square with dots in the corners ,n,13:18,0:10,10,0,23,,,,,,y
16,2,23,NG,1,1,1,14:09,Um there was a triangle with dots in the corners and then there was another four sided figure with dots in all of the corners ,n,14:23,0:14,14,1,26,,,,,,y
17,3,1,NG,0,3,3,0:19,So it was it was like um it's like a wided out triangle but the point the point was pointing towards my right and the line was like straight down and then on the other side it looked like um a rhombus was on the side of it ,n,0:46,0:27,27,5,49,,,,,,y
17,3,3,NG,0,2,1,2:39,So it so the image described it was a rectangle with a dot in the middle and then I think under it it was a line with both dots at the end ,n,2:55,0:16,16,2,33,,,,,,y
17,3,10,NG,0,2,1,9:16,So this so this one was like a little asterisk star so there was a line in the middle I think it was about so five like um three on each axle six like spreading out and the upper middle and downward position they all had dots at the beginning and the end of them ,n,9:45,0:29,29,3,56,,,,,,y
17,3,13,NG,1,3,4,12:51,So it was a rectangle it was a rectangle um but the dot at the um in the middle of the bottom line connected with a triangle ,n,13:06,0:15,15,3,28,,,,,,y
17,3,19,NG,0,4,3,18:51,So we got two triangles one triangle had a dot in the middle and the other one is a regular triangle with all of the dots ,n,19:01,0:10,10,0,27,,,,,,y
17,3,24,NG,0,1,2,23:28,So you have basically you have two two di two diamonds on top of each other going from up to down there's a dot in the middle thas connecting them two ,n,23:47,0:19,19,3,32,,,,,,y
18,1,2,NG,0,2,2,1:16,Okay so there's a hexagon and it has dots at each corner of it and then one in the middle okay ,n,1:29,0:13,13,0,22,,,,,,y
18,1,6,NG,0,1,1,4:03,So there are two triangles and one is like to the right and above the other one and they're all connected by lines with dots where the lines connect and one triangle's like upside down the one on the bottom ,n,4:23,0:20,20,0,41,,,,,,y
18,1,7,NG,0,3,1,4:54,Um so there's oh no a line underneath a shape that's like four sides but two of the sides are longer than the other two and they're all connected by lines and dots ,n,5:21,0:27,27,2,34,,,,,,y
18,1,11,NG,1,1,2,7:40,Okay so there's a square and it's like slanted and it's on top of a um rectangle type and they all have dots on the ends like where they connect with the other lines ,n,8:05,0:25,25,1,35,,,,,,y
19,1,2,NG,1,3,3,1:18,Okay there was a um it was an octagon with a dot on each corner and a dot in the middle ,n,1:31,0:13,13,2,22,,,,,,y
19,1,6,NG,2,4,2,5:01,Okay there was a triangle on top with a dot on each corner and a dot on the middle of the bottom line then there was also a rhombus on the bottom with a dot on each corner ,n,5:20,0:19,19,0,39,,,,,,y
19,1,11,NG,1,1,3,9:57,There was a rhombus on top with a dot on each corner um and there was a there was an octagon octagon on the bottom with four dots uh one two dots on the top corners and then two dots on the bottom corners ,n,10:30,0:33,33,5,45,,,,,,y
19,1,16,NG,0,2,1,14:09,There was two triangles um facing each other the middle point so a point on each tip of the triangle with was a joint between the two and then there was a tri dots on each dside each corner and then dots in the middle of aech base of the triangle ,n,14:37,0:28,28,4,52,,,,,,y
19,1,18,NG,0,3,2,16:23,Okay there 6was there was two shapes on the right there was a trian I want to say a triangle no a rhombus it was a rhombus with two points and then on the left side there was a uh um vertical rectangle with two point a point on each top corner then on the left side there was a dot there was three dots from the corner the corner you go down there's a dot in the middle a dot on the bottom ,n,17:19,0:56,56,6,85,,,,,,y
19,1,20,NG,2,5,2,19:03,Okay there was three triangles uh the one on the bottom facing up was two dots on the bottom base corners there was a dot in the middle of all the triangles the triangle on the right facing the facing left there was two dots on the base corner and in the opposite triangle there was two dots on the base corners ,n,19:37,0:34,34,2,63,,,,,,y
19,1,22,NG,1,4,1,20:53,Okay there was two triangles on the bottom um there was they each had a point at the top a point in the uh base corners there was a middle point that joined the two and then there was a line above the triangle with a point on each side of the line,n,21:18,0:25,25,3,53,,,,,,y
20,2,4,NG,3,4,4,2:29,Okay there was like a traepzoid type shape but it was on its side I guess so like there was a short vertical line and then next to that a longer vertical line and these two lines were connected to make sort of like a sideways trapezoid and then to the right of that shape was another shape that I didn't quite see before it disappeared ,n,2:58,0:29,29,0,67,,,,,,y
20,2,5,NG,0,4,1,3:25,Okay there were two triangles the one on the left was a right angle triangle that had a dot on each vertex as well as one dot it's sort of like in the middle but not the exact center of the hypotenuse and then the triangle next to it was more of a scalene looking triangle with a dot on each vertex but no extra dots ,n,3:48,0:23,23,0,67,,,,,,y
20,2,12,NG,3,5,3,9:28,So there was a triangle toward the bottom left corner of the screen and the triangle had a dot at each corner like each vertex and then toward the top right corner of the screen there was a parallelogram that also had a dot at each vertex ,n,9:46,0:18,18,0,48,,,,,,y
20,2,15,NG,4,5,4,11:32,So there were two triangles like one of themkinda like overlayed on top of the other so the one triangle was very tall and skinny and upside down it had a dot at each vertex and then the other triangle was shorter and fatter and it was right side up and also had a dot at each corner ,n,11:52,0:20,20,0,59,,,,,,y
20,2,17,NG,0,0,1,12:46,So there was a really big square that had a dot at each corner and the bottom line of the square had a dot in it and then off of that dot there was an upside down triangle with inside the square so a big square and then a smaller triangle inside of it with the bottom corner of sq triangle on the bottom line of the square ,n,13:10,0:24,24,1,69,,,,,,y
